[
 {
  "id": "claude-code",
  "name": "Claude Code",
  "kind": "agent_platform",
  "used_for": "the agent that builds and runs NarrativeOS",
  "where": "this PC",
  "version": null,
  "licence": "Anthropic terms",
  "status": "in_use",
  "notes": null,
  "mirror": null
 },
 {
  "id": "claude-in-chrome",
  "name": "Claude in Chrome",
  "kind": "agent_platform",
  "used_for": "reading Gemini chats, Pixabay pages and YouTube transcripts in the owner's browser",
  "where": "owner's Chrome",
  "version": null,
  "licence": "Anthropic terms",
  "status": "in_use",
  "notes": null,
  "mirror": null
 },
 {
  "id": "github",
  "name": "GitHub + gh CLI",
  "kind": "service",
  "used_for": "the repo (Hxtra/NarrativeOS), pushes, reading other repos",
  "where": "github.com",
  "version": null,
  "licence": "GitHub terms",
  "status": "in_use",
  "notes": null,
  "mirror": null
 },
 {
  "id": "earshot",
  "name": "Earshot",
  "kind": "tool",
  "used_for": "the ears: describe/match/rank sounds, real vs synthesized, timeline and sync, profile and critique, a 201-sound code bank",
  "where": "NarrativeOS-Data/tools/earshot (scripts/earshot_bridge.py)",
  "version": "0.3.0 @ 925ebe5",
  "licence": "MIT",
  "status": "in_use",
  "notes": "alpha, one author; ships its own skills 'earshot' and 'real-sound'",
  "mirror": "github.com/Hxtra/earshot (fork, Oct 23; contains 925ebe5 and all 5 branches)"
 },
 {
  "id": "lemo-opuscar",
  "name": "Lemo-Opuscar",
  "kind": "tool",
  "used_for": "code-made films: three.js scenes rendered frame by frame in Chrome, stills, video, mux with grain and -14 LUFS",
  "where": "NarrativeOS-Data/tools/lemo-opuscar",
  "version": "0.1.0 @ 508848a",
  "licence": "MIT",
  "status": "in_use",
  "notes": null,
  "mirror": "github.com/Hxtra/lemo-opuscar (fork, Oct 23; contains 508848a)"
 },
 {
  "id": "remotion",
  "name": "Remotion (+ React, TypeScript)",
  "kind": "library",
  "used_for": "the template components (title cards, transitions, captions) and graphic segments",
  "where": "templates/narrativeos-video-templates/project",
  "version": "4.0.524",
  "licence": "Remotion License (free for individuals and small companies; a company licence above that)",
  "status": "in_use",
  "notes": "check the licence before NarrativeOS becomes a commercial app",
  "mirror": null
 },
 {
  "id": "three",
  "name": "three.js",
  "kind": "library",
  "used_for": "3D scenes in the films (via Lemo-Opuscar)",
  "where": "Lemo-Opuscar",
  "version": "^0.170.0",
  "licence": "MIT",
  "status": "in_use",
  "notes": null,
  "mirror": null
 },
 {
  "id": "playwright",
  "name": "Playwright (core)",
  "kind": "library",
  "used_for": "drives Chrome to render film frames",
  "where": "Lemo-Opuscar",
  "version": "^1.63.0",
  "licence": "Apache-2.0",
  "status": "in_use",
  "notes": null,
  "mirror": null
 },
 {
  "id": "ffmpeg",
  "name": "FFmpeg",
  "kind": "tool",
  "used_for": "every encode, mux, cut, loudness measurement and contact sheet",
  "where": "installed (winget)",
  "version": "9.0.1 full_build (gyan.dev)",
  "licence": "GPL (this build)",
  "status": "in_use",
  "notes": null,
  "mirror": null
 },
 {
  "id": "effectcraft",
  "name": "EffectCraft + FilmCraft",
  "kind": "tool",
  "used_for": "After-Effects-style rebuilds of measured shots (reconstruct/effectcraft.py)",
  "where": "installed (Program Files)",
  "version": "0.10.0 / 0.8.0",
  "licence": "open source (verify)",
  "status": "in_use",
  "notes": "remake work; headless CLI",
  "mirror": null
 },
 {
  "id": "kdenlive",
  "name": "Kdenlive + melt (MLT)",
  "kind": "tool",
  "used_for": "the earlier rebuild backend (reconstruct/rebuild.py)",
  "where": "installed",
  "version": "25.12.3 / melt 7.37",
  "licence": "GPL",
  "status": "installed_not_current",
  "notes": null,
  "mirror": null
 },
 {
  "id": "node",
  "name": "Node.js",
  "kind": "runtime",
  "used_for": "Remotion, Lemo-Opuscar, the Studio UI build",
  "where": "installed",
  "version": "25",
  "licence": "MIT",
  "status": "in_use",
  "notes": null,
  "mirror": null
 },
 {
  "id": "python",
  "name": "Python (3.13 main; 3.12 for Earshot)",
  "kind": "runtime",
  "used_for": "all NarrativeOS code",
  "where": "installed",
  "version": "3.13 / 3.12",
  "licence": "PSF",
  "status": "in_use",
  "notes": null,
  "mirror": null
 },
 {
  "id": "uv",
  "name": "uv",
  "kind": "tool",
  "used_for": "separate Python 3.12 environments (Earshot, shazamio)",
  "where": "installed",
  "version": "0.12.15",
  "licence": "MIT or Apache-2.0",
  "status": "in_use",
  "notes": null,
  "mirror": null
 },
 {
  "id": "numpy",
  "name": "NumPy",
  "kind": "library",
  "used_for": "all numeric work",
  "where": "pip",
  "version": "2.4.3",
  "licence": "BSD-3",
  "status": "in_use",
  "notes": null,
  "mirror": null
 },
 {
  "id": "scipy",
  "name": "SciPy",
  "kind": "library",
  "used_for": "signal processing",
  "where": "pip",
  "version": "1.17.1",
  "licence": "BSD-3",
  "status": "in_use",
  "notes": null,
  "mirror": null
 },
 {
  "id": "librosa",
  "name": "librosa",
  "kind": "library",
  "used_for": "audio features, onsets, beats, resampling",
  "where": "pip",
  "version": "1.0.0",
  "licence": "ISC",
  "status": "in_use",
  "notes": null,
  "mirror": null
 },
 {
  "id": "soundfile",
  "name": "soundfile",
  "kind": "library",
  "used_for": "reading and writing audio",
  "where": "pip",
  "version": "0.14.0",
  "licence": "BSD-3",
  "status": "in_use",
  "notes": null,
  "mirror": null
 },
 {
  "id": "soxr",
  "name": "python-soxr",
  "kind": "library",
  "used_for": "high-quality resampling (16 kHz for Whisper)",
  "where": "pip",
  "version": "1.1.0",
  "licence": "LGPL-2.1+ (verify)",
  "status": "in_use",
  "notes": null,
  "mirror": null
 },
 {
  "id": "opencv",
  "name": "OpenCV (headless)",
  "kind": "library",
  "used_for": "frames, optical flow, camera motion, cuts",
  "where": "pip",
  "version": "5.0.0.93",
  "licence": "Apache-2.0",
  "status": "in_use",
  "notes": null,
  "mirror": null
 },
 {
  "id": "pillow",
  "name": "Pillow",
  "kind": "library",
  "used_for": "images, contact sheets",
  "where": "pip",
  "version": "11.3.0",
  "licence": "HPND (MIT-like)",
  "status": "in_use",
  "notes": null,
  "mirror": null
 },
 {
  "id": "jsonschema",
  "name": "jsonschema",
  "kind": "library",
  "used_for": "catalog and IR schema checks",
  "where": "pip",
  "version": "4.26.0",
  "licence": "MIT",
  "status": "in_use",
  "notes": null,
  "mirror": null
 },
 {
  "id": "torch",
  "name": "PyTorch (CPU)",
  "kind": "library",
  "used_for": "runs Demucs, PANNs and Earshot's models",
  "where": "pip (+ Earshot venv)",
  "version": "2.11.0 / 2.14.1",
  "licence": "BSD-3",
  "status": "in_use",
  "notes": null,
  "mirror": null
 },
 {
  "id": "mediapipe",
  "name": "MediaPipe",
  "kind": "library",
  "used_for": "faces, hands, person segmentation (frame awareness)",
  "where": "pip (--no-deps)",
  "version": "1.1.0",
  "licence": "Apache-2.0",
  "status": "in_use",
  "notes": null,
  "mirror": null
 },
 {
  "id": "rapidocr",
  "name": "RapidOCR + onnxruntime",
  "kind": "library",
  "used_for": "on-screen text (typography)",
  "where": "pip",
  "version": "3.9.2 / 1.30.0",
  "licence": "Apache-2.0 / MIT",
  "status": "in_use",
  "notes": null,
  "mirror": null
 },
 {
  "id": "faster-whisper",
  "name": "faster-whisper",
  "kind": "library",
  "used_for": "speech to text, word timings",
  "where": "pip",
  "version": "1.2.1",
  "licence": "MIT",
  "status": "in_use",
  "notes": null,
  "mirror": null
 },
 {
  "id": "demucs",
  "name": "Demucs",
  "kind": "library",
  "used_for": "splitting music into voice, drums, bass and other",
  "where": "pip",
  "version": "4.1.0",
  "licence": "MIT",
  "status": "in_use",
  "notes": "run with --shifts 0 for reproducible stems",
  "mirror": null
 },
 {
  "id": "panns-inference",
  "name": "panns-inference",
  "kind": "library",
  "used_for": "AudioSet sound tagging (sound_tags.py, sfx_check.py)",
  "where": "pip",
  "version": "0.1.1",
  "licence": "MIT",
  "status": "in_use",
  "notes": null,
  "mirror": null
 },
 {
  "id": "google-genai",
  "name": "google-genai",
  "kind": "library",
  "used_for": "the Gemini watcher (reconstruct/watch.py)",
  "where": "pip",
  "version": "2.30.0",
  "licence": "Apache-2.0",
  "status": "in_use",
  "notes": null,
  "mirror": null
 },
 {
  "id": "shazamio",
  "name": "shazamio",
  "kind": "library",
  "used_for": "music identification windows (departments.py)",
  "where": "uv --with (Python 3.12)",
  "version": null,
  "licence": "MIT",
  "status": "in_use",
  "notes": "talks to Shazam's unofficial endpoint: may break; not a licensed API",
  "mirror": null
 },
 {
  "id": "whisper-models",
  "name": "Whisper models (base, small, medium.en) via faster-whisper",
  "kind": "model",
  "used_for": "speech to text",
  "where": "Hugging Face cache",
  "version": null,
  "licence": "MIT",
  "status": "in_use",
  "notes": null,
  "mirror": null
 },
 {
  "id": "htdemucs",
  "name": "HTDemucs weights",
  "kind": "model",
  "used_for": "stems",
  "where": "Hugging Face / torch cache",
  "version": null,
  "licence": "MIT",
  "status": "in_use",
  "notes": null,
  "mirror": null
 },
 {
  "id": "panns-cnn14",
  "name": "PANNs Cnn14 checkpoint",
  "kind": "model",
  "used_for": "AudioSet tags",
  "where": "NarrativeOS-Data/models/panns_data",
  "version": null,
  "licence": "verify (published on Zenodo)",
  "status": "in_use",
  "notes": null,
  "mirror": null
 },
 {
  "id": "mediapipe-models",
  "name": "MediaPipe face, hand and selfie-segmentation models",
  "kind": "model",
  "used_for": "frame awareness",
  "where": "~/NarrativeOS-Models (to move into NarrativeOS-Data)",
  "version": null,
  "licence": "Apache-2.0",
  "status": "in_use",
  "notes": null,
  "mirror": null
 },
 {
  "id": "clap",
  "name": "LAION CLAP (laion/larger_clap_general)",
  "kind": "model",
  "used_for": "Earshot: matching sounds to descriptions",